tweets,quote_status,language,favorite_count,retweet_count,time,id,sentiment,neg,neu,pos,compound,processed_text,cleaned_tweets,cleaned_neg,cleaned_neu,cleaned_pos,cleaned_compound,neg.1,neu.1,pos.1,compound.1,neg,neu,pos,compound
"Why are the riverdale writers so scary to let Jughead and Veronica interact?? The time jump + Barchie was the perfect time to finally explore Jeronica but nope. I’m seeing the potential with Jughead and Tabitha doe,won’t lie. #RiverdaleSeason5 #Riverdale #jughead #Jughead",False,en,8,1,2021-02-24 13:15:51,1364564700818771972,"Sentiment(polarity=0.125, subjectivity=1.0)",0.066,0.8809999999999999,0.053,-0.1451,"['riverdale', 'writers', 'scary', 'let', 'jughead', 'veronica', 'interact', 'time', 'jump', 'barchie', 'perfect', 'time', 'finally', 'explore', 'jeronica', 'nope', 'seeing', 'potential', 'jughead', 'tabitha', 'doe', 'lie', 'riverdaleseason5', 'riverdale', 'jughead', 'jughead']",riverdale writers scary let jughead veronica interact time jump barchie perfect time finally explore jeronica nope seeing potential jughead tabitha doe lie riverdaleseason5 riverdale jughead jughead,0.104,0.777,0.12,0.128,0.10400000000000001,0.777,0.12,0.128,0.104,0.777,0.12,0.128
"RT @RiverdaleRefer1: Prayer circle:

                    🕯      🕯
           🕯                         🕯
                    Jeronica…",False,en,0,10,2021-02-24 11:51:45,1364543537417777153,"Sentiment(polarity=0.0, subjectivity=0.0)",0.0,1.0,0.0,0.0,"['prayer', 'circle', 'jeronica']",prayer circle jeronica,0.0,1.0,0.0,0.0,0.0,1.0,0.0,0.0,0.0,1.0,0.0,0.0
Manifesting for Jeronica crumbs tomorrow omg please! 😩🥺 #Riverdale #Jeronica #Vughead https://t.co/8Ec65aC1V0,False,en,25,5,2021-02-24 03:18:17,1364414317618212866,"Sentiment(polarity=0.0, subjectivity=0.0)",0.0,0.809,0.191,0.3802,"['manifesting', 'jeronica', 'crumbs', 'tomorrow', 'omg', 'please', 'riverdale', 'jeronica', 'vughead']",manifesting jeronica crumbs tomorrow omg please riverdale jeronica vughead,0.0,0.777,0.223,0.3182,0.0,0.777,0.223,0.3182,0.0,0.777,0.223,0.3182
"RT @BarrosEsquerdo: I find it interesting how the Riverdale series makes Jugh and Veronica so compatible. The two have surreal connections,…",False,en,0,9,2021-02-23 21:56:14,1364333269634998278,"Sentiment(polarity=0.375, subjectivity=0.75)",0.0,0.8759999999999999,0.124,0.4019,"['find', 'interesting', 'riverdale', 'series', 'makes', 'jugh', 'veronica', 'compatible', 'two', 'surreal', 'connections']",find interesting riverdale series makes jugh veronica compatible two surreal connections,0.0,0.787,0.213,0.4019,0.0,0.787,0.213,0.4019,0.0,0.787,0.213,0.4019
@ShellyLahey Guess this is where she goes full circle back to being a jeronica acting as if she never left🤭,False,en,3,0,2021-02-23 19:59:16,1364303834722443270,"Sentiment(polarity=0.11666666666666665, subjectivity=0.18333333333333335)",0.0,1.0,0.0,0.0,"['guess', 'goes', 'full', 'circle', 'back', 'jeronica', 'acting', 'never', 'left']",guess goes full circle back jeronica acting never left,0.0,1.0,0.0,0.0,0.0,1.0,0.0,0.0,0.0,1.0,0.0,0.0
"Happy Birthday to lovely friend, fellow jeronica warrior &amp; just overall badass awesome person @talllestiptoes ! Hopefully you're enjoying the day despite these batshit times &lt;3 https://t.co/y4bLJBRXaV",False,en,0,0,2021-02-23 19:00:08,1364288954539900928,"Sentiment(polarity=0.5599999999999999, subjectivity=0.67)",0.038,0.455,0.507,0.9665,"['happy', 'birthday', 'lovely', 'friend', 'fellow', 'jeronica', 'warrior', 'amp', 'overall', 'badass', 'awesome', 'person', 'hopefully', 'enjoying', 'day', 'despite', 'batshit', 'times', 'lt', '3']",happy birthday lovely friend fellow jeronica warrior amp overall badass awesome person hopefully enjoying day despite batshit times lt 3,0.046,0.348,0.606,0.9652,0.046,0.348,0.606,0.9652,0.046,0.348,0.606,0.9652
Went back to when she started hating Jeronica for not having scenes and...? https://t.co/h1k7BOZCFi,False,en,7,0,2021-02-23 13:24:31,1364204495144509444,"Sentiment(polarity=0.0, subjectivity=0.0)",0.202,0.7979999999999999,0.0,-0.5106,"['went', 'back', 'started', 'hating', 'jeronica', 'scenes']",went back started hating jeronica scenes,0.398,0.602,0.0,-0.5106,0.39799999999999996,0.602,0.0,-0.5106,0.398,0.602,0.0,-0.5106
@barcheated ... Jessica?? Why would she come back to him when he treated her like trash? And Betty has no feelings for him anymore it’s been seven years 😭😭😭 anyways the way she gave up on Jeronica and suddenly is acting like she always shipped them and that she didn’t make fun of us......,False,en,3,0,2021-02-23 13:11:36,1364201242545717249,"Sentiment(polarity=0.09999999999999999, subjectivity=0.06666666666666667)",0.036000000000000004,0.8190000000000001,0.145,0.7677,"['jessica', 'would', 'come', 'back', 'treated', 'like', 'trash', 'betty', 'feelings', 'anymore', 'seven', 'years', 'anyways', 'way', 'gave', 'jeronica', 'suddenly', 'acting', 'like', 'always', 'shipped', 'make', 'fun', 'us']",jessica would come back treated like trash betty feelings anymore seven years anyways way gave jeronica suddenly acting like always shipped make fun us,0.0,0.7170000000000001,0.28300000000000003,0.8074,0.0,0.7170000000000001,0.28300000000000003,0.8074,0.0,0.717,0.283,0.8074
